SHLAA Ref,Address,Area ha,_something_,Capacity,I&O RAG,Settlement Hierarchy,Green/Brown,Reason,Easting,Northing
1251,"Leeds Road, Collingham  LS22",4.5,"",101,R,"",Greenfield,Green Belt site. In isolation the site would have an unacceptable impact on the Green Belt as it would form an isolated development and not round off the settlement.  The southern part of the site is also within an area of high flood risk and the site requires the adjacent site to the east for access. Site is not required to meet the housing numbers due to local preference for an alternative strategic option.,437852,445449
1252,"Northgate Lane, Linton  LS22",2.3,"",52,P,"",Greenfield,Sieved out - Not within the settlement hierarchy,438597,447195
1262,"Roundhay Park Lane, Sandy Lodge (site of)  LS17 8AS",1,"",31,A,"",Mixed,"Green Belt site. Site is well related to the settlement and would round off the settlement. However, the site lies adjacent to a cluster of listed buildings and is not required to meet the housing numbers due to local preference for an alternative strategic option.",432897,439918
1271,"Rakehill Road (land off), Scholes, LS15",112.3,"",2528,R,"",Greenfield,Large Green Belt site which is out of scale with the existing settlement. The development of the site would have an unacceptable impact on the Green Belt in terms of unrestricted sprawl and safeguarding the countryside from encroachment.,438288,437439
1286,"Colliers Lane (land off), Shadwell, LS17",3.2,"",72,P,"",Greenfield,Sieved out - Not within the settlement hierarchy,434181,439398
1287,"Blind Lane (land at), Shadwell, LS17",2.7,"",60,P,"",Greenfield,Sieved out - Not within the settlement hierarchy,434248,439612
1288,"Manor Farm (land at), Shadwell, LS17",13.1,"",294,P,"",Greenfield,Sieved out - Not within the settlement hierarchy,434560,439483
1289,"Dowkell Lane (land north of), Thorpe Arch, Boston Spa",12.1,"",317,P,"",Greenfield,Sieved out - Not within the settlement hierarchy,443481,446397
1290,"Thorpe Arch - The Vicarage (land to rear of), Boston Spa",0.8,"",25,P,"",Greenfield,Sieved out - Not within the settlement hierarchy,443416,445829
1291,"Lilac Farm (land at), Lilac Farm, Collingham  LS22",8.1,"",183,A,"",Greenfield,Green Belt site. The development of the site would have an unacceptable impact on the Green Belt in terms of unrestricted sprawl and safeguarding the countryside from encroachment.,439417,445943
1292,"Jewitt Lane (paddock at), Collingham, LS22",1.1,"",31,R,Smaller Settlement Infill,Mixed,"The site is within the existing settlement of Collingham, not within the Green Belt.  However, Highways concerns regarding access to the site and the existing highway network.  The site slopes significantly and mature trees surround the narrow entrance to the existing dwelling on site which reduces development potential.",439127,445733
1293,"Harewood Road (land at), Collingham LS22",4.6,"",103,A,"",Greenfield,Green Belt Site. Site is steeply sloping. Site is not required to meet the housing numbers due to local preference for an alternative strategic option.,437581,445512
1294,"Leeds Road (land at), Collingham  LS22",5.4,"",121,R,"",Greenfield,"Green Belt site.  The southern part of the site juts out from the existing settlement form and has no defensible boundary containing it, which could set a precedent for further sprawl into Green Belt. Highways concerns raised due to the narrow road frontage and poor accessibility to services.",438547,445335
1300,"Linton Lane - land opposite the Ridge, Linton   LS22",1.7,"",54,P,"",Greenfield,Sieved out - Not within the settlement hierarchy,439184,447244
1301,"Linton Lane - Wetherby Golf Course house and car park, Wetherby LS22",0.6,"",19,R,"",Greenfield,"Green Belt site.  The site is not related to the existing settlement given that site 1070 is situated between the site and the existing built up area.  (It is noted that site 1070 presently contains one detached dwelling, however this was deemed to be appropriate within the Green Belt.)  No defensible boundary is present to the south side of the site which could lead to further unrestricted sprawl into Green Belt. The site currently contains a golf clubhouse and car park, which is acceptable, appropriate development in  the Green Belt.  Development of the site would therefore also result in the loss of a community facility given that the clubhouse would have to be demolished.",439358,447935
1304,"Larumrise (land to the west of), off Willow Lane, Clifford  LS23",2.1,"",56,P,"",Greenfield,Sieved out - Not within the settlement hierarchy,442428,444444
1309,Linton Lane (land to the rear of)  LS22,3.5,"",92,P,"",Greenfield,Sieved out - Not within the settlement hierarchy,439065,447577
1315,"Holywell Lane / Bridle Path Road (land to east of), Shadwell LS17",2.2,"",50,P,"",Greenfield,Sieved out - Not within the settlement hierarchy,434033,440213
1316,"Bridle Path Road (land to north of), Shadwell, LS17",1.2,"",33,P,"",Greenfield,Sieved out - Not within the settlement hierarchy,434068,440436
1324,Ling Lane - Stonecroft   LS17 9JN,0.8,"",22,NonIO,"",Brownfield,Sieved out - Not within the settlement hierarchy,435054,441296
1329,"Blackmoor Lane (land to north of), Bardsey, Leeds",1.2,"",32,P,"",Greenfield,Sieved out - Not within the settlement hierarchy,435835,442716
1367,"Rakehill Road (land north of), Barwick in Elmet",1.3,"",34,R,"",Greenfield,Green Belt site.  Development of this site alone would not relate well to the existing settlement form and would have an unacceptable impact on the Green Belt,439666,437624
1368,"Rakehill Road (land south of), Barwick in Elmet",3.1,"",71,R,"",Greenfield,"Green Belt site, adjoining the existing settlement on two sides.  However, concerns regarding potential harm to the setting of the scheduled ancient monument and the conservation area.  Highway concerns regarding poor access and narrow local roads. Site is not required to meet the housing numbers due to local preference for an alternative strategic option.",439689,437456
5162,Land at Whinmoor Lane Redhall,19.4,"",508,NonIO,Main Urban Area Extension,Greenfield,Green Belt site. The development of the site would have an unacceptable impact on the Green Belt in terms of unrestricted sprawl and safeguarding the countryside from encroachment.,434368,438883
5163,Land at Wike Ridge Lane Slaid Hill,4.9,"",129,NonIO,"","",Green Belt site. The development of the site would have an unacceptable impact on the Green Belt in terms of sprawl and safeguarding the countryside from encroachment.,432876,440624
2059,"Oakhill Cottage Farm, Shadwell  LS17",13.8,"",363,R,"",Greenfield,"Green Belt site.  The site is an important gateway into the countryside from the ring road, with views from the ring road giving the edge of the main urban area a 'rural feel'.   The northern boundary is connected to the existing settlement but the west and eastern boundaries are open, so the site does not relate well to the existing settlement form and is unacceptable in terms of Green Belt impact.  Highway concerns regarding poor accessibility.",433156,439418
2067,"Thorp Arch Grange, Wetherby  LS23",0.6,"",16,A,"",Greenfield,Sieved out - Not within the settlement hierarchy,443996,447056
2068,"Thorp Arch Estate Waste Tip, Wetherby  LS23",10.1,"",227,P,"",Greenfield,Sieved out - Not within the settlement hierarchy,445346,446042
2158,"Sandbeck wood (south of), Wetherby",5.4,"",141,A,Major Settlement Extension,Greenfield,"The site is not within the Green Belt, however it is open countryside which is currently safeguarded  by rural land policy (RL1) within the UDP. The site is isolated from the main urban area of Wetherby with limited access across the A1(M) which creates a significant barrier to the existing settlement of Wetherby. Site is not required to meet the housing numbers due to local preference for an alternative strategic option.",441289,449462
3019,Land off Whinmoor Lane Shadwell,4.1,"",92,P,"",Greenfield,Sieved out - Not within the settlement hierarchy,434321,439220
3020,Land at Elmete Lane Shadwell,2.2,"",50,P,"",Greenfield,Sieved out - Not within the settlement hierarchy,434113,439126
3114,"Barwick Road, Garforth",1.2,"",38,A,"",Greenfield,Green Belt site.  Proposed HS2 rail route runs to the north of the site. The site is very isolated from the main settlement. The development of the site would have an unacceptable impact on the Green Belt in terms of sprawl and protecting the countyside from encroachment.  Highways concerns re access - route to Garforth constrained by narrow railway bridge and access to the site itself is down a narrow unadopted road.  Major site 1232B to east of Garforth chosen on balance as a better site for development than the combined sites to the west/north of Garforth.,440095,433864
3125,"Carr Lane, Wetherby",2.3,"",59,A,Major Settlement Extension,Greenfield,"The site is not within the Green Belt, however it is open countryside which is currently safeguarded  by rural land policy (RL1) within the UDP. The site is isolated from the main urban area of Wetherby with limited access across the A1(M) which creates a significant barrier to the existing settlement of Wetherby. Site is not required to meet the housing numbers due to local preference for an alternative strategic option.",441278,449095
3126,"Syke Lane, Scarcroft",1.1,"",31,P,"",Greenfield,Sieved out - Not within the settlement hierarchy,436066,441854
3127,"Wetherby Road, Scarcroft",5.1,"",114,P,"",Greenfield,Sieved out - Not within the settlement hierarchy,436386,441208
3128,"Land west of Deepdale Lane, Boston Spa",2.2,"",59,A,"",Greenfield,Green Belt site. No defensible boundary to the west of the site which could set a precedent for further sprawl. Site is not required to meet the housing numbers due to local preference for an alternative strategic option.,442126,445949
3129,"Moor End, Boston Spa",2.5,"",65,A,"",Greenfield,Green Belt site. Site is not required to meet the housing numbers due to local preference for an alternative strategic option.,441799,445231
3130,"Primrose Lane (west), Boston Spa",3.7,"",96,R,"",Greenfield,"Green Belt site. Development would result in the crossing of Primrose Lane which is currently a strong defensible boundary,  which could set a precedent for further sprawl which would reduce the Green Belt gap between Boston Spa and Clifford.",442368,445207
3131,"Primrose Lane (east), Boston Spa",1.6,"",49,R,"",Greenfield,"Green Belt site. Development would result in the crossing of Primrose Lane which is currently a strong defensible boundary,  which could set a precedent for further sprawl which would reduce the Green Belt gap between Boston Spa and Clifford.",442686,445260
3133,"Woodacre Lane (north), Bardsey",1.7,"",47,R,"",Greenfield,Green Belt site.  The site is situated on a very steep slope. Highways raise concerns due to lack of access options and poor accessibility. Site is not required to meet the housing numbers due to local preference for an alternative strategic option.,436452,443737
3134,"Woodacre Lane, Bardsey",9.1,"",205,R,"",Greenfield,"Green Belt site. The beck and mature tree line create a strong boundary to the east between the built up area and the site.  The surrounding road network is narrow and there are significant Highways concerns. The site also lies adjacent to a conservation area and Motte and Bailey, Castle Hill Ancient Monuments.  In addition the site is situated on a significant slope and as a consequence any development would be very prominent within the landscape. Site is not required to meet the housing numbers due to local preference for an alternative strategic option.",436579,443560
3135,Land south of Wetherby Race Course (adj to Race Course),17.2,"",450,R,"",Greenfield,"The site is not within Green Belt, however it is open countryside which is currently safeguarded by rural land policy (RL1) within the UDP. The development of the site is reliant on the development of 3136 for access.  Development of the site would be unrelated to the existing settlement and represent a significant incursion into open countryside extending to the southeast of Wetherby.  Presently the A1(M) forms a strong defensible boundary between the urban area and the countryside. The site would be isolated from the main urban area of Wetherby with very limited across the A1(M) which creates a significant access barrier to the existing settlement.",441926,448431
3136,"Land south of Wetherby Race Course, Walton Road",34.2,"",898,R,"",Greenfield,"The site is not within Green Belt, however it is open countryside which is currently safeguarded by rural land policy (RL1) within the UDP.  Development of the site would be unrelated to the existing settlement and represent a significant incursion into open countryside extending to the southeast of Wetherby.  Presently the A1(M) forms a strong defensible boundary between the urban area and the countryside. The site would be isolated from the main urban area of Wetherby with very limited across the A1(M) which creates a significant access barrier to the existing settlement.",441678,448168
3309,"Scarcroft Cottage, Wetherby Road, Scarcroft, Leeds, LS14 3HJ",0.5,"",13,P,"",Mixed,Sieved out - Not within the settlement hierarchy,436200,440886
3310,"Land Boston Road, Wetherby",1.5,"",53,R,Major Settlement Infill,Greenfield,Piece of open land adjacent to the river with adds to the character of the conservation area. The site slopes significantly down towards the river. Flooding issues as the majority of the site lies within flood zones 3b (washland) and 3a (high risk).The site also has very poor access.,440538,447810
3317,railway sidings at scholes,3.3,"",75,R,"",Greenfield,"Green Belt site. The site is a disused railway track and is therefore linear and extends out into the Green Belt, totally unrelated to the existing settlement form.  Development would create a linear island site not considered acceptable development in the Green Belt.   Highways concerns regarding access.",,
3319,"Main Street, Aberford",1,"",28,P,"",Greenfield,Sieved out - Not within the settlement hierarchy,443415,437008
3322,Winnow Lane,14.6,"",384,R,"",Greenfield,Green Belt site. The development of the site would be unacceptable in Green Belt terms as it would result in unrestricted sprawl and fail to protect the countryside from encroachment. Site is not required to meet the housing numbers due to local preference for an alternative strategic option.,441569,445458
3323,"Land at Brandon Golf Course, Shadwell",4.5,"",118,P,"",Greenfield,Sieved out - Not within the settlement hierarchy,433738,440259
3325,Land at Thorner Lane Leeds,6.3,"",142,R,"",Greenfield,Green Belt site. The site is set in an isolated position and does not relate to any of the nearby settlements. The site would have an unacceptable impact on the Green Belt in terms of unrestricted sprawl and encroachment of the countryside,437152,438431
3332,"High Trees School, Boston Spa",0.8,"",27,R,"",Greenfield,Green Belt site. The site would have an unacceptable impact on the Green Belt in terms of unrestricted sprawl and safeguarding the countryside from encroachment. The site is also protected as green space.,443230,444925
3333,"Land off Ling Lane, Scarcroft",2.9,"",65,P,"",Greenfield,Sieved out - Not within the settlement hierarchy,435069,441150
3334,Land South of A58 Collingham,6.3,"",142,R,"",Greenfield,"Green Belt site. The development of the site would constitute a significant encroachment into the Green Belt. The site is detached from the settlement of Collingham, unless adjacent sites are developed first.  The site is further separated from the northern part of Collingham by Collingham Beck. The site boundary does not follow any field boundaries so no strong defensible boundaries currently exist. Highways concerns regarding access.",438294,445313
3363,"Mill Lane, Bardsey",0.4,"",11,P,"",Greenfield,Sieved out - Not within the settlement hierarchy,437113,443491
3371,"Sweep Farm, Wetherby",32.8,"",861,R,"",Greenfield,Green Belt site. The development of the site would have an unacceptable impact on the Green Belt in terms of unrestricted sprawl and safeguarding the countryside from encroachment.,440370,437117
3375,Boundary between Green Belt and Urban Developement,1.7,"",45,R,"",Greenfield,Green Belt site. Site is not required to meet the housing numbers due to local preference for an alternative strategic option.,444313,441530
3429,"Land off Black Moor Lane, Bardsey",2.6,"",59,P,"",n/a,Sieved out - Not within the settlement hierarchy,441870,436369
3437,"Parlington Estate, Aberford",2.4,"",53,P,"",Brownfield,Sieved out - Not within the settlement hierarchy,442407,435045
3438,"Aberford Road, Aberford",1.2,"",31,P,"",Mixed,Sieved out - Not within the settlement hierarchy,438504,446654
3448,Land off Trip Lane Linton,4.1,"",92,P,"",Greenfield,Sieved out - Not within the settlement hierarchy,440341,439513
3452,Land off Potterton Lane,17.1,"",385,P,"",Greenfield,Sieved out - Not within the settlement hierarchy,440099,439528
3453,Land off Potterton Lane,1.7,"",46,P,"",Brownfield,Sieved out - Not within the settlement hierarchy,435937,442622
3461,"Land off Tithe Barn Lane, Bardsey",1.1,"",31,P,"",Greenfield,Sieved out - Not within the settlement hierarchy,433266,440222
4018,Shadwell Lane,4.1,"",109,R,"",Greenfield,Green Belt site. Development of the site would significantly reduce the Green Belt gap between Leeds conurbation and Shadwell and extend the linear form of the existing built up urban area.  No Highways issues raised.,439231,446036
4079,"Site of Prison Social Club, Walton Road, Wetherby",0.9,"",23,A,"",Mix 65:35,Sieved out - Not within the settlement hierarchy,440496,449219
4096,"Nidd Vale Motors, Wetherby",0.4,"",15,G,Major Settlement Infill,Brownfield,"Site is being persued for alternative uses by the land owner, subject to planning permission.",442201,443441
4151,Ferndale House Shadwell,1.1,"",31,NonIO,"",Greenfield,Sieved out - Not within the settlement hierarchy,442838,442649
4152,"Aberford Road, Bramham",0.4,"",12,NonIO,Smaller Settlement Infill,Greenfield,Existing green space site. Site to be retained for green space use and is not available for development.,433083,440431
4154,"Wike Ridge Lane, Alwoodly",3.6,"",94,NonIO,"",Greenfield,Green Belt site adjacent to existing residential development on two sides. Local flooding/drainage concerns. Site is not required to meet the housing numbers due to local preference for an alternative strategic option.,437396,445460
4155,"Land at Harewood Road, Collingham",4.1,"",93,NonIO,"",Greenfield,Green Belt Site. The site is reliant on the development of an adjacent site to round off the settlement. Site is steeply sloping. Site is not required to meet the housing numbers due to local preference for an alternative strategic option.,436314,440937
4162,"Land to the rear of Woodland Gardens, Scarcroft",1.4,"",38,NonIO,"",Greenfield,Sieved out - Not within the settlement hierarchy,436219,440982
4163,"Woodland Gardens, Scarcroft",0.5,"",12,NonIO,"",Greenfield,Sieved out - Not within the settlement hierarchy,437067,443469
4165,"Hampson House, Bardsey",0.4,"",11,NonIO,"",Greenfield,Sieved out - Not within the settlement hierarchy,433312,439966
4166,Land South of Shadwell Lane,6.1,"",159,NonIO,"",Greenfield,Green Belt site. The site would have a unacceptable impact on the Green Belt in terms of sprawl and coalescence as it would significantly reduce the gap between main urban area of Leeds and Shadwell.,443496,441073
4167,"Spen Common Lane Infill, Bramham",8.1,"",0,NonIO,"",Greenfield,Green Belt site. This site has been incorporated into site 3391.,434927,438850
4170,"Whinmoor Lane, Shadwell",1.5,"",0,NonIO,"",Greenfield,Green Belt site. The site would have an unacceptable impact on the Green Belt in terms of unrestricted sprawl and safeguarding the countryside from encroachment. Do not want to promote new development directly outside the East Leeds Orbital Road; this principle is established all along its route.,444005,445143
4176,"High Street, Boston Spa",2.5,"",66,NonIO,"",Greenfield,Green Belt site. The site in would have an unacceptable impact on the Green Belt in terms of unrestricted sprawl and safeguarding the countryside from encroachment. Site is not required to meet the housing numbers due to local preference for an alternative strategic option.,436127,444949
4201,"Land at Rose Croft, East Keswick,",1.2,"",33,NonIO,"",Greenfield,Sieved out - Not within the settlement hierarchy,443210,446123
4218,Thorp Arch & Boston Spa Cricket Ground,1.1,"",39,NonIO,"",Greenfield,Sieved out - Not within the settlement hierarchy,439786,437576
4221,Barwick,0.5,"",13,NonIO,Smaller Settlement Infill,Brownfield,"Brownfield site, not within the Green Belt. Significant tree cover to the north section of the site. Access concerns.",439768,436787
4229,"Land behind Wyncroft Court, Barwick in Elmet",2.7,"",61,NonIO,"",Greenfield,Green Belt site. The site would have an unacceptable impact on the Green Belt in terms of unrestricted sprawl and safeguarding the countryside from encroachment.,442554,445689
4234,"Field & Well Opposite 4 Oaks Farm, Boston Spa",0.8,"",29,NonIO,Smaller Settlement Infill,Greenfield,Site situated within consevation area. No suitable options to safely access the site,437254,441511
5001,"Thorner Lane, Scarcroft",2.5,"",55,NonIO,"",Greenfield,Sieved out - Not within the settlement hierarchy,433699,440017
5022,"Land South Of Main Street, Shadwell LS17 8ES",4,"",105,NonIO,"","",Sieved out - Not within the settlement hierarchy,436705,443865
5134,Land at Wetherby Road/Walton Road Walton,12,"",270,NonIO,"","",Sieved out - Not within the settlement hierarchy,440951,448552
5142,Land north of A58 Wetherby,13.5,"",354,NonIO,"","",Green Belt site. The site in isolation would have an unacceptable impact on the Green Belt in terms of unrestricted sprawl and safeguarding the countryside from encroachment. Significant ecology concerns given the prescence of a SEGI,438350,440830
5154,Land north of Bramham Road Thorner,4.1,"",92,NonIO,"","",Sieved out - Not within the settlement hierarchy,436658,444001
5158,Meadowside Keswick lane Bardsey,0.4,"",11,NonIO,"","",Green Belt site. Flood risk concerns. Also significant ecology concerns given the close proximity to Bardsey beck. Site is not required to meet the housing numbers due to local preference for an alternative strategic option.,Northing,area
7,"Bridge Street - All Saints Mill, Otley LS21 1BQ",0.5,"",48,G,Major Settlement Infill,Brownfield,Site with current or recently expired planning permission or existing UDP allocation. Principle of residential development accepted,,
317,"Wharfedale General Hospital, Newall Carr Road, Otley",1.8,"",61,G,Major Settlement Infill,Brownfield,Site with current or recently expired planning permission or existing UDP allocation. Principle of residential development accepted,419888,446568
364,"Creskeld Crescent (11) - Bramwood, Bramhope  LS16",1.1,"",8,LG,Smaller Settlement Infill,Brownfield,Site with current or recently expired planning permission or existing UDP allocation. Principle of residential development accepted,425538,443222
684,"Church Lane, Adel  LS16",2.6,"",45,LG,Main Urban Area Infill,Greenfield,Site with current or recently expired planning permission or existing UDP allocation. Principle of residential development accepted,427128,440156
744,"Rumplecroft, Otley",5.2,"",135,LG,Major Settlement Infill,Greenfield,Site with current or recently expired planning permission or existing UDP allocation. Principle of residential development accepted,419183,446687
745,Otley (east of),30.9,"",550,LG,Major Settlement Infill,Greenfield,Site with current or recently expired planning permission or existing UDP allocation. Principle of residential development accepted,421285,445363
749,"Prince Henry Court, Newall Carr Road, Otley",0.7,"",3,LG,Major Settlement Infill,Brownfield,Site with current or recently expired planning permission or existing UDP allocation. Principle of residential development accepted,420015,446317
3190,"Manor Garage, Leeds Road, Otley",0.3,"",14,NonIO,Major Settlement Infill,Brownfield,Site with current or recently expired planning permission or existing UDP allocation. Principle of residential development accepted,420680,445049
3348,"The Manor House And Clitherow House, Our Lady And All Saints Church, Manor Square, Otley",0.1,"",6,LG,Major Settlement Infill,Brownfield,Site with current or recently expired planning permission or existing UDP allocation. Principle of residential development accepted,420141,445672
5127,"The Tannery, Leeds Road, Otley, LS21 1QX",0.3,"",10,LG,Major Settlement Infill,Brownfield,Site with current or recently expired planning permission or existing UDP allocation. Principle of residential development accepted,420771,445019
HLA2901390,"23-5 Manor Square, Otley",0,"",8,LG,Major Settlement Infill,Brownfield,Site with current or recently expired planning permission or existing UDP allocation. Principle of residential development accepted,,
1122,"Mill Lane - Garnetts Paper Mill, Otley",9.9,"",245,LG,Major Settlement Infill,Brownfield,Site suitable for residential development with offices.,420652,445987
1002,"Creskeld Lane, Bramhope - land to rear of no. 45",1.5,"",23,A,Smaller Settlement Extension,Greenfield,"Most of the site is within the settlement boundary, part green belt.  Suitable for residential development.",425751,443505
1080,"Breary Lane East, Bramhope LS16",15.4,"",289,A,Smaller Settlement Extension,Greenfield,Protected Area of Search (PAS) site on UDP.Potential for development of site with site 3367A to provide 384 dwellings.  Site 3367A or 1080 to accommodate a 2 FE primary school (deduct 58 dwellings from the combined capacity),426068,443041
2035,"East Chevin Road, Otley",1.5,"",54,G,Major Settlement Infill,Brownfield,Conforms with CS hierarchy.  Brownfield site within urban area,420599,445032
