SHLAA Ref,Address,Area ha,_something_,Capacity,I&O RAG,Settlement Hierarchy,Green/Brown,Reason,Easting,Northing
34,"Low Hall Road -Riverside Mill, Horsforth LS19",7.9,"",60,LG,Main Urban Area Extension,Brownfield,Site with current or recently expired planning permission or existing UDP allocation. Principle of residential development accepted,421771,437622
271,"Springfield Road - Springhead Mills, Guiseley",1.9,"",54,LG,Major Settlement Infill,Brownfield,Site with current or recently expired planning permission or existing UDP allocation. Principle of residential development accepted,419291,442038
734,"Bradford Road - High Royds, Menston",24.6,"",337,LG,Other,Brownfield,Site with current or recently expired planning permission or existing UDP allocation. Principle of residential development accepted,417484,442962
738,"Netherfield Road - Cromptons, Guiseley",5.4,"",116,LG,Major Settlement Infill,Brownfield,Site with current or recently expired planning permission or existing UDP allocation. Principle of residential development accepted,418731,442635
741,"Greenlea Road, Yeadon",1,"",30,LG,Major Settlement Infill,Greenfield,Site with current or recently expired planning permission or existing UDP allocation. Principle of residential development accepted,419995,440357
742,"Netherfield Road, Guiseley",3.2,"",98,LG,Major Settlement Infill,Greenfield,Site with current or recently expired planning permission or existing UDP allocation. Principle of residential development accepted,418881,442425
3164,"Haworth Court, Chapel Lane",0.6,"",21,LG,Major Settlement Infill,Brownfield,Site with current or recently expired planning permission or existing UDP allocation. Principle of residential development accepted,420729,441188
3187,"Station Garage, Henshaw Lane, Yeadon",0.3,"",5,LG,Major Settlement Infill,Brownfield,Site with current or recently expired planning permission or existing UDP allocation. Principle of residential development accepted,420560,440548
3229,"Batter Lane, Rawdon",0.4,"",4,LG,Major Settlement Infill,Brownfield,Site with current or recently expired planning permission or existing UDP allocation. Principle of residential development accepted,421003,439923
5111,"Former Dairy Crest Site, Queensway, Guiseley",0.6,"",14,NonIO,Major Settlement Infill,Brownfield,Site with current or recently expired planning permission or existing UDP allocation. Principle of residential development accepted,419595,442135
5121,Parkside Works Otley Road Guiseley,0.2,"",7,LG,Major Settlement Infill,Brownfield,Site with current or recently expired planning permission or existing UDP allocation. Principle of residential development accepted,418884,441960
HLA2700370,26-28 New Road Side Horsforth,0,"",5,LG,Major Settlement Infill,Brownfield,Site with current or recently expired planning permission or existing UDP allocation. Principle of residential development accepted,,
HLA2802390,107 Queensway Yeadon,0.1,"",9,LG,Major Settlement Infill,Brownfield,Site with current or recently expired planning permission or existing UDP allocation. Principle of residential development accepted,,
HLA2802490,The Drop Inn 29 Town Street Guiseley,0.2,"",6,LG,Major Settlement Infill,Brownfield,Site with current or recently expired planning permission or existing UDP allocation. Principle of residential development accepted,,
12,"Larkfield Drive (off) - Ivy House (adjacent), Rawdon",0.5,"",6,A,Major Settlement Infill,Greenfield,"Access would require removal of existing dwelling.  There is a Tree Preservation Order over the site, however, the site has only limited tree cover and this could be considered in detailed design.",421124,439489
180,"Swaine Hill Terrace - Brookfield Nursing Home, Yeadon",0.4,"",7,R,Major Settlement Infill,Brownfield,"Allocate. Conversion site above 0.4ha, detail the requirement that redevelopment would not be acceptable.",420209,441344
1113,"Silverdale Avenue (land at) , Guiseley",2,"",32,R,Major Settlement Infill,Greenfield,Allocate the site for housing with stipulations that half of the site looking onto Silverdale Avenue be laid out for allotments with a management plan to ensure that they are available for public use. Demand for allotments in the area and proper laying out of the site will increase useage.,419046,441426
1180A,"Coach Road (land off), Guiseley LS20",1.2,"",37,A,Major Settlement Extension,Greenfield,A comprehensive development along with sites 1311A and 2163A would be appropriate.  Traffic calming in Silverdale Estate would be required.,419075,441233
1199,"Moseley Wood Gardens (land off), Cookridge  LS16",11.4,"",0,G,Main Urban Area Extension,Greenfield,"Protected Area of Search (PAS) site on existing UDP.  Most of the site falls within North Leeds area, but capacity and area have been split between Aireborough and North Leeds on a pro-rata basis.  The railway is considered to form a strong defensible boundary which would prevent further sprawl.  Capacity limited to 200 due to access constraints (split over two areas).",424481,440361
1221,"Gill Lane, Yeadon  LS19",5.9,"",155,G,Major Settlement Extension,Greenfield,"This site is well contained and related to the urban area, with no Highways objections raised.  The Core Strategy acknowledges that to meet the housing requirement green belt sites will need to be released, and development of this site will be of less harm to green belt purposes than other suggested green belt sites.",420097,440562
1255B,"Shaw Lane (land at), Guiseley and Banksfield Mount, Yeadon",8.9,"",234,G,Major Settlement Extension,Greenfield,"Green Belt site.  Site 1255 has been split into two sections, as the northern section is not considered suitable for development.  By splitting the site in two the southern section relates better to the settlement and a lower capacity puts less pressure on the existing highway network. Single point of access from Banksfield Mount limits site capacity.",420315,442133
1308,"Green Lane (land to the rear of Naylor Jennings Mill) , Yeadon",6,"",179,G,Major Settlement Infill,Brownfield,"Brownfield site within urban area, so residential development acceptable in principle.",420834,440446
1311A,"Coach Road (land to the south of) , Guiseley",1.2,"",38,A,Major Settlement Extension,Greenfield,A comprehensive development along with sites 1180A & 2163A would be appropriate.  Traffic calming in Silverdale Estate would be required.,419242,441218
2038,"Low Mills, Guiseley",7.2,"",144,A,Major Settlement Infill,Mix 30:70,Allocate site for housing.  The site is not in the green belt and is well contained. Flooding and  Highway issues regarding access can be mitigated against as part of the design and layout of the site.,419407,441003
2163A,"Park Road (South of) Sodhall Hill, Guiseley",2.9,"",8,A,Major Settlement Extension,Greenfield,"Green Belt site.  The site has been split in two as the southern section is considered unsuitable for development. A comprehensive development along with sites 1180A & 1311A would be appropriate. Site A (the northern section) has a road frontage and relates well to the urban area, when considered with 1180A and 1311A.   This smaller site (ie site A) will put less pressure on the road network. Traffic calming in Silverdale Estate would be required. Possible location of a school on this site.",418894,441318
3026,"New Birks Farm, Ings Lane, Guiseley",11.3,"",298,A,Major Settlement Extension,Greenfield,"Site relates well to uran area and is contained by adjacent development, incluidng the school to the north west. Development would round off the settlement.  Highways mitigation measures would be required.",418248,442788
3029,"Wills Gill, Guiseley",5.1,"",133,R,Major Settlement Extension,Greenfield,Green Belt site. The site is well connected to the urban area.,419789,442279
3366,"Land at Victoria Avenue, Leeds",3.9,"",102,G,Major Settlement Extension,Greenfield,Green Belt site.  Self contained between existing housing and airport runway.  Development would constitute rounding off of settlement.  Site would need to be accessed from a new roundabout on Victoria Avenu,421790,441405
4019,"Kirkland House, Queensway, Yeadon",0.5,"",17,G,Major Settlement Infill,Brownfield,Brownfield site in urban area.  Residential accptable in principle.,420335,441562
4020,"Hollins Hill and Hawkstone Avenue, Guiseley",3,"",80,A,Major Settlement Extension,Greenfield,Development would form an extension to the existing residential area. A strong defensible boundary will be required to prevent urban sprawl.,418346,441154
4254,"Woodlands Drive, Rawdon",4.9,"",130,NonIO,Major Settlement Extension,Greenfield,Adjacent to residential development despite being set away from the main urban area. Site to be PAS with 4095 and 3331,421877,438443
3329,"Land at Rawdon, Leeds",3.6,"",95,G,Major Settlement Extension,Greenfield,"Green Belt site adjoining the southern boundary of 5145.  The 2 sites together would create a relatively self contained site, notwithstanding the fact that the site does form part of the Green Belt gap between Rawdon and Horsforth.  The site is well contained due to the trees along the eastern boundary, which are protected by a Tree Preservation Order and provide natural screening.  Poterntial for development in the longer term.  Designation as safeguardded land considered most appropriate.",422303,438903
3331,"Land at Rawdon, Leeds",1,"",35,G,Major Settlement Extension,Greenfield,"Green belt site, but well contained and would not constitute sprawl if developed.  Could be developed along with 4095. The sites would need to jointly provide a realignment of Knott Lane to provide a 90 degree approach to the A65. Accessibility by public transport and to facilities is good. Site proposed as safeguarded land as less sequentially preferable to other sites.",422117,438506
4043,"Ings Lane, Guiseley",3.6,"",90,A,Major Settlement Extension,Greenfield,"Site is contained by existing development & the railway line and so relates relatively well to the existing settlement. Sufficient frontage for access, would require footway on frontage and crossing points to footway opposite. Accessibility to public transport poor, other facilities acceptable. Identified as safeguarded land as less sequentially preferable to other sites.",418431,443004
4095,"Land to west of Knott Lane, Rawdon",1.9,"",61,G,Major Settlement Extension,Greenfield,"",422040,438657
5145,Rear of Layton Wood (Layton Croft) Rawdon,1.1,"",35,NonIO,Major Settlement Extension,Greenfield,"Green Belt site adjoining the northern boundary of site 3329. The two sites together would create a relatively contained site, notwithstanding the fact that the site does form part of the Green Belt gap between Rawdon and Horsforth.  Potential for development in the longer term.  Designation as safeguarded land considered most appropriate.",422359,439154
63,"Woodlands Drive - Cragg Wood Nurseries,  Rawdon",1.1,"",33,P,"",Greenfield,Not within settlement hierarchy,420492,438841
1017,"Hawksworth Lane (land at), Hawksworth Nurseries",1,"",31,P,"",Greenfield,Not within settlement hierarchy,416668,441668
1103,"Bradford Road, Guiseley  LS20",0.2,"",7,G,Major Settlement Infill,Mixed,Planning permission inplemented. Site suitable for housing.,418208,442605
1104,"Greenside Farm, Yeadon  LS19",2.2,"",58,A,"",Mixed,Green Belt site. Existing city farm on site. Development of site 1104 in isolation would constitute urban sprawl. Significant public objections.  Proposed conservation area issues.,420272,440229
1148,"Bradford Road (land off), Guiseley",20.5,"",539,R,"",Greenfield,"Green Belt site.  Development of the site would result in a breach of Thorpe Lane, an important boundary preventing sprawl towards Bradford. The Green Belt is necessary to prevent coalescence between settlements of Guiseley and Menston.  The site is attractive and a designated Special Landscape Area.",417776,442413
1180B,"Coach Road (land off), Guiseley LS20",2.7,"",72,R,"",Greenfield,Green Belt site.  The site has been split in two as the southern section is considered unsuitable for development due to Highways concerns and the fact that development would not be well related to the existing settlement pattern.,418970,441156
1186,"Cross Lane (land at), off Carlton Lane, Guiseley LS21",3.4,"",77,P,"",Greenfield,Not within settlement hierarchy,420358,443426
1189,"Bramston Lodge (land at), Carlton, Near Yeadon",2.6,"",59,P,"",Greenfield,Not within settlement hierarchy,421982,442947
1194,"Thorpe Lane (land at) - Hawksworth Lane, Guiseley LS20",2.2,"",58,R,"",Greenfield,Green Belt site.  The site is not considered to be well connected to the urban area.  Thorpe Lane is a main road and acts a strong defensible boundary that should not be breached.  Development of the site would set a precedent for urban sprawl.,417242,441646
1254,"Moor Lane (land at), Guiseley",1.2,"",39,P,"",Greenfield,Not within settlement hierarchy,419377,443079
1255A,"Shaw Lane (land at), Guiseley and Banksfield Mount, Yeadon",6.8,"",180,R,"",Greenfield,"Green Belt site.  Site 1255 has been split into two sections, as the northern section is not considered suitable for development.  Development of site A would constitute urban sprawl and unacceptable pressure on highway capacity.",420328,442306
1256,"Wills Gill (land at), off Carlton Lane, Guiseley",11.1,"",289,R,"",Greenfield,"Green Belt site.  The site is not well connected to the urban area, and would not constitute rounding off of the settlement. As such development would represent urban sprawl.  The site has access constraints.",419801,442510
1311B,"Coach Road (land to the south of) , Guiseley",1.2,"",38,R,"",Greenfield,Green Belt site. The site has been split in two as the southern section is considered unsuitable for development.   Development of site B would extend further into the green belt and not relate well to the existing settlement pattern.,419237,441119
1326,"Town End (land at), Carlton, Yeadon  LS19",13.4,"",301,P,"",Greenfield,Not within settlement hierarchy,421859,443241
2118,"Haw Lane, Yeadon",2.3,"",60,R,"",Greenfield,This site is designated as a Village Green and so is not considered suitable for development.,420857,441609
2119,"Canada Road, Rawdon",1.1,"",34,R,"",Greenfield,"Whilst the site is considered to be well related to the urban area,  Highways object to development of the site due to poor visibility of site access.",421428,439971
2160,"Scotland Lane, Ling Bob, Horsforth",72.9,"",0,R,"",Mixed,Green Belt site. The site is not supported by Highways and development would lead to urban sprawl.,423998,440140
2161,"Westfield Mount (west of), Yeadon",3.2,"",83,R,"",Greenfield,Part Green Belt.  The site has no road frontage and would require the development of the adjoining SHLAA site 2038 for access purposes. The western section of the site is a designated Site of Special Scientific Interest (SSSI) and could not be developed. The eastern section is covered in dense trees and is also considered unsuitable.,419418,440796
2162,"Warm Lane (north of), Yeadon",2.8,"",72,A,"",Greenfield,Significant public objection.  Proposed conservation area issues,420126,440269
2163B,"Park Road (South of) Sodhall Hill, Guiseley",13,"",76,R,"",Greenfield,Green Belt site.  The site has been split in two as the southern section is considered unsuitable for development due to Highways concerns and the fact that development would not be well related to the existing settlement pattern.  The quality of the road network would prevent a large development (both A and B) in this area.,418846,441135
3028,"Kelcliffe Lane, Guiseley",11.5,"",396,R,"",Mixed,"Green Belt site.  Visible location above the urban area.  Development would constitute urban sprawl, unrelated to the existing settlement pattern.  Highways issues regarding access.",419100,442786
3030,"Banksfield Crescent, Yeadon",3.8,"",101,R,"",Greenfield,Green Belt site.  Part of the site also falls within the designated Village Green. Development of the site in isolation would be unrelated to the existing settlement pattern and constitute urban sprawl.,420833,441738
3031,"Land Behind 1-19 Westfield Oval, Yeadon",1.3,"",41,R,"",Mixed,"Green Belt site, not particularly well related to the existing settlement pattern.  Highways concerns re access - adoptable highway not considered achievable.",419550,440546
3033,Land to east of Apperley Lane,8.2,"",214,A,"",Mixed,Significant public objection.  Proposed conservation area issues.,420267,439979
3034,"Cold Harbour Farm, Bayton Lane, Yeadon",74.6,"",0,R,"",Greenfield,"Green Belt site. The site covers the area commonly known as Rawdon Billings and envelopes Billing Hill, a protected nature area. The site is large and development would have a serious impact on the openness of the Green Belt and result in a large area of urban sprawl. The site is not supported by Highways.",421945,439941
3326,"Land at Rawdon, Leeds",7.6,"",200,R,"",Greenfield,Green Belt site.  The site contains a Site of Ecological or Geological Interest (SEGI) and is not considered suitable for development.The area not covered by a SEGI is separated from the settlement and given the sensitive nature of the area development is not considered appropriate.,421966,440811
5151,Land N of Holmehurst off Apperley Lane Rawdon,1.2,"",37,NonIO,"",Greenfield,"A Green Belt site located within Cragg Wood Conservation Area. Whilst there are existing properties located in proximity to the site which lie within the Green Belt boundary, development of the site would create an irregular Green Belt boundary potentially leading to further urban sprawl and narrowing the gap between Leeds and Bradford.",420335,439372
5152,Land S of Holmehurst off Apperley Lane Rawdon,3.1,"",82,NonIO,"",Greenfield,"A Green Belt site located within Cragg Wood Conservation Area. Whilst the site lies adjacent to existing properties within the Green Belt, designating the site would create a site separated from the existing built up area and create an irregular Green Belt boundary leading to further potential urban sprawl and narrowing the gap between Leeds and Bradford.",420230,439173
182,"Springfield Mount (19), Woodhouse LS2 9NG",0.1,"",7,LG,City Centre Infill,Brownfield,Identified site with permission.,429170,434337
204,Hanover Square (32)  LS3 1AW,0,"",7,LG,City Centre Infill,Brownfield,Identified site with planning permission,429093,433934
394,New York Road - Crispin House  LS2,0.1,"",85,LG,City Centre Infill,Brownfield,Residential conversion completed after the base date of the plan - April 2012.,430510,433955
395,The Calls (36),0,"",14,LG,City Centre Infill,Brownfield,Planning permission for 14 flats.,430489,433258
406,Manor Road (16-18)  LS11,0.1,"",57,G,City Centre Infill,Brownfield,"Holbeck Urban Village location suitable for residential development.  Planning permission in 2006 preferred residential above ""A"" uses, with no B1 office.",429703,432689
407,Manor Road  LS11,1.9,"",748,G,City Centre Infill,Brownfield,Previous permission being revised to accord with current planning application proposal for high density apartment scheme.,429803,432624
HLA2005280,"Algernon Firth Building, LGI, Thoresby Place Leeds",0.2,"",43,NonIO,City Centre Infill,Brownfield,Student housing scheme recently completed,,
2029,Leeds Metropolitan University  LS1 3HE,1.7,"",119,G,City Centre Infill,Brownfield,Site available with planning permission,429804,434238
3018,4 St Peters Place Leeds LS9,0,"",18,LG,City Centre Infill,Brownfield,Residential conversion permitted.,430861,433491
3138,3-4 Blenheim Terrace LS2,0.1,"",1,LG,City Centre Infill,Brownfield,Permitted scheme.,429759,434552
3139,25-27 Hyde Terrace LS1,0.1,"",11,LG,City Centre Infill,Brownfield,Permitted scheme,429082,434277
3140,23 Hyde Terrace LS2,0,"",6,LG,City Centre Infill,Brownfield,Permitted scheme,429100,434265
3141,40 Clarendon Road LS2,0.1,"",6,LG,City Centre Infill,Brownfield,Permitted scheme,429033,434261
3160,29-31 Hyde Park Terrace LS2,0.1,"",6,LG,City Centre Infill,Brownfield,Permitted scheme,429061,434292
3307,Leeds Metropolitan University  LS1 3HE,1.4,"",199,LG,City Centre Infill,Brownfield,Permitted scheme largely complete,429746,434312
3337,"29 Kirkgate and 18 New York Street, Leeds LS2",0,"",8,LG,City Centre Infill,Brownfield,Permitted scheme,430501,433431
3338,"8 Springfield Mount, Leeds LS2 9ND",0,"",9,LG,City Centre Infill,Brownfield,Permitted scheme,429220,434380
3339,"20-28 Hyde Terrace, Leeds LS2 9LN",0.1,"",27,LG,City Centre Infill,Brownfield,Permitted scheme,429222,434253
3340,"65 Clarendon Road, Leeds, LS2 9NZ",0.1,"",12,LG,City Centre Infill,Brownfield,Permitted scheme,428984,434213
3347,"15-19 Hyde Terrace, Leeds, LS2 9LT",0.1,"",14,LG,City Centre Infill,Brownfield,Permitted scheme,429134,434242
3460,Black Bull Street,0.1,"",26,NonIO,City Centre Infill,Brownfield,Site with current or recently expired planning permission or existing UDP allocation. Principle of residential development accepted,430451,432790
4180,"31 Clarendon Road, LS2 9NZ",0.1,"",10,NonIO,City Centre Infill,Brownfield,Permitted scheme,429158,434146
4181,"44 Claredon Road, LS2 9PJ",0,"",5,NonIO,City Centre Infill,Brownfield,Permitted scheme,429024,434287
4183,"74 New Briggate, LS1",0.1,"",7,NonIO,City Centre Infill,Brownfield,Permitted scheme,430409,433917
4190,"Forsyth House, 5 South Parade, City Centre",0,"",13,NonIO,City Centre Infill,Brownfield,Permitted scheme,429852,433753
4195,"Pennine House, LS1 5RN",0.1,"",112,NonIO,City Centre Infill,Brownfield,Permitted scheme,429864,433640
5103,"63 Great George Street, Leeds, LS1 3bb",0,"",5,NonIO,City Centre Infill,Brownfield,Permitted scheme,429584,433947
5104,"18 Queen Square, Leeds, LS2",0,"",7,NonIO,City Centre Infill,Brownfield,Permitted scheme,430103,434234
5108,"First And Second Floors And Loft Space, 46-48 New York Street",0,"",7,NonIO,City Centre Infill,Brownfield,Permitted scheme,430637,433432
5115,"22-23 Blenheim Terrace, Leeds, LS2 9HD",0.1,"",9,NonIO,City Centre Infill,Brownfield,Permitted scheme,429643,434667
5122,17 Regent Street Sheepscar,0.2,"",73,LG,City Centre Infill,Brownfield,Permitted scheme,430820,434200
5156,"Clarendon House, 20 Clarendon Road",0.2,"",24,NonIO,City Centre Infill,Brownfield,Permitted scheme,429192,434200
5157,"6 - 12 Lands Lane, LS1 6LD",0.1,"",18,NonIO,City Centre Infill,Brownfield,Permitted scheme,430184,433609
HLA2005090,"36 Clarendon Road, Woodhouse, Leeds, LS9 9NZ",0.1,"",7,LG,City Centre Infill,Brownfield,Permitted scheme,,
181,Sweet Street West (20) - Management Archives,0.5,"",140,LG,City Centre Infill,Brownfield,"Outline permission in 2010 for mixed use development comprising 140 flats, 1,850sqm of offices and 140sqm of A1.",429494,432608
202,Silver Street - Midland Mills  LS11 9YW,0.4,"",15,LG,City Centre Infill,Brownfield,Suitable for mixed office/residential development.  Permission granted in 2010 to convert and extend the listed mill building with 3112sqm offices and 15 flats.,429339,432791
205,"Granary Wharf Car Park, off Water Lane  LS11 5PS",0.4,"",68,LG,City Centre Infill,Brownfield,"Suitable for mixed residential/office development. Planning permission was given in 2008 and renewed in 2011 for 68 flats, 6,800sqm of offices and 650sqm of A3/A4 use.",429659,432999
402,Cropper Gate - Mayfair LS1,0.2,"",272,LG,City Centre Infill,Brownfield,"Suitable city centre site for office/residential development.  Planning permission granted in 2009 (20/283/04/FU) for 266 dwellings with 3,620sqm of office space",429170,433556
405,Globe Road - Tower Works  LS10,1.1,"",134,LG,City Centre Infill,Brownfield,Very accessible central site.  Site suited to office and residential development.  Office development largely completed prior to the base-date of the Plan.  A more recent change of use for 141sqm remains to be completed.,429583,433000
409,Bath Road  LS11,1,"",240,G,City Centre Infill,Brownfield,Suitable site for mixed office/residential development with planning permission.,429425,432799
423,Whitehall Road - Aireside,1.5,"",600,LG,City Centre Infill,Brownfield,"Outline planning permission anticipates 600 dwellings within a predominantly office area.  The site adjacent to the river would be more attractive for residential development, but with offices at lower floor levels.",429216,433255
445,Jack Lane / Sweet Street  LS10,2.9,"",296,G,City Centre Infill,Brownfield,"Site is suitable and available for a mixed use development with residential, offices, leisure and ""A"" uses.  It has lapsed permission for a large mixed use scheme 95570 for office, 3982 for A uses, 31760 for leisure and 296 apartments.",429808,432414
450,Globe Road / Water Lane  LS11,1.8,"",263,LG,City Centre Infill,Brownfield,"Suitable and available development site, with temporary car park permissions due to expire 2017.  Mixed use comprises of 263 dwellings plus office floorspace of 18720sqm (taken from overlapping employment sites 2004680 (10660sqm) and 2004545 (8060sqm).",429426,432967
454,Portland Crescent  LS1,0.9,"",50,LG,City Centre Infill,Brownfield,"Site has outline planning permission from 2007 which is still live by virtue of phase 1 being completed.  This site is covered by phase 2 of the planning permission which anticipates between 2500 and 7000sqm of office space along with floorspace for 50 dwellings and hotel space.  As per Issues and Options, assume 4000sqm for offices in a mixed use allocation",429893,434185
458,Sweet Street West (Land South of) Holbeck,3.1,"",830,LG,City Centre Infill,Brownfield,"Suitable and appropriate site for mixed use development on the edge of Leeds city centre with outline planning permission.  Includes residential, office and 0.3ha of general employment land.",429479,432495
3017,St Peters church & house,0.3,"",35,A,City Centre Infill,Brownfield,Permission granted for mixed residential office scheme.,430665,433262
5123,"30 Sovereign Street, Leeds, LS1 4BA",0,"",5,LG,City Centre Infill,Brownfield,Suitable building for mixed office/residential conversion with permission granted in 2010,430178,433138
